{
  "analysisContract": {
    "catalogDigest": "b34e77e7dee2b92ab4a7d364a0557bcd2b5afc4462bfee4ef82655d83fbd404d",
    "classifierRevision": 1,
    "compilerContext": "local-relative-import-graph-no-external-framework-or-target-config",
    "detectorRevision": 1,
    "exceptions": "owner-evidence-not-loaded-review-required",
    "parser": {
      "digest": "3ae902c92cc44dace175c0e69e13a4b0899f6983c6121d76b9ab8dd5795e7675",
      "name": "typescript",
      "version": "5.9.3"
    },
    "ruleBindingDigest": "a58c27d4cbb89ad4cf6eb7e899f58e0352c5b2f8519e1c15aac23d8a076e850e",
    "runtimeContentDigest": "b3815331dd6edf0c2e5ee265635ba47bf1c331b56f35b7a83e0abdf423bed06b",
    "scannerVersion": "0.1.0",
    "sourceContentIdentity": "8d0a774fc6b9656a92fbfda997e1c6a7dab8e3a6a26e0ba11166c6288aea56e5",
    "sourceMode": "installed"
  },
  "catalog": [
    {
      "detectorIds": [
        "fe-component-dependency"
      ],
      "familyId": "fe-component-dependencies",
      "implementationStatus": "automated",
      "lane": "fe-main",
      "note": "Injection-shaped candidates; framework/ownership resolution incomplete.",
      "selectedLaneFiles": 1
    },
    {
      "detectorIds": [
        "fe-store-await"
      ],
      "familyId": "fe-store-purity",
      "implementationStatus": "automated",
      "lane": "fe-main",
      "note": "Await/async and selected call candidates; no full flow equivalence.",
      "selectedLaneFiles": 1
    },
    {
      "detectorIds": [
        "fe-explicit-any",
        "fe-non-null"
      ],
      "familyId": "fe-t6-types",
      "implementationStatus": "automated",
      "lane": "fe-main",
      "note": "Explicit syntax; decorated assertions need exception resolution.",
      "selectedLaneFiles": 1
    },
    {
      "detectorIds": [],
      "familyId": "fe-facade-flow-lifecycle",
      "implementationStatus": "not-implemented",
      "lane": "fe-main",
      "note": "R2/R4/R5 orchestration, signals, conversion, subscriptions and trivial-view exceptions need semantic/contract review.",
      "selectedLaneFiles": 1
    },
    {
      "detectorIds": [],
      "familyId": "fe-new-code-naming",
      "implementationStatus": "not-implemented",
      "lane": "fe-main",
      "note": "Selectors/file/handler naming needs new/touched entity applicability.",
      "selectedLaneFiles": 1
    },
    {
      "detectorIds": [],
      "familyId": "fe-generated-provenance",
      "implementationStatus": "not-implemented",
      "lane": "fe-main",
      "note": "Boundaries classified; generator drift/hand-edit provenance not asserted.",
      "selectedLaneFiles": 1
    },
    {
      "detectorIds": [
        "fe-library-public-surface"
      ],
      "familyId": "fe-library-public-contract",
      "implementationStatus": "review-only",
      "lane": "fe-library",
      "note": "Export/alias and approved facade/store islands require owner/consumer review, never automatic breaking-change classification.",
      "selectedLaneFiles": 1
    },
    {
      "detectorIds": [],
      "familyId": "fe-library-naming",
      "implementationStatus": "not-implemented",
      "lane": "fe-library",
      "note": "New no-suffix/selector naming and legacy exceptions need entity history.",
      "selectedLaneFiles": 1
    },
    {
      "detectorIds": [],
      "familyId": "fe-library-feature-contracts",
      "implementationStatus": "not-implemented",
      "lane": "fe-library",
      "note": "Service-first behavior, README/Playground and generated boundaries need owned contracts.",
      "selectedLaneFiles": 1
    },
    {
      "detectorIds": [
        "be-namespace-observation"
      ],
      "familyId": "be-fixed-namespace",
      "implementationStatus": "automated",
      "lane": "be-main",
      "note": "Lexical declaration/reference candidates; conditional compilation unresolved.",
      "selectedLaneFiles": 1
    },
    {
      "detectorIds": [],
      "familyId": "be-type-and-async-shape",
      "implementationStatus": "not-implemented",
      "lane": "be-main",
      "note": "Public type counts, new Async/Task names, sync-over-async and empty catch need C# parser/semantic context.",
      "selectedLaneFiles": 1
    },
    {
      "detectorIds": [],
      "familyId": "be-boundaries-and-http-jobs",
      "implementationStatus": "not-implemented",
      "lane": "be-main",
      "note": "DTO/Domain/persistence, thin triggers/controllers and OAuth/HTTP response contracts need owner evidence.",
      "selectedLaneFiles": 1
    },
    {
      "detectorIds": [],
      "familyId": "be-runtime-contracts",
      "implementationStatus": "not-implemented",
      "lane": "be-main",
      "note": "Cancellation, identity/request precedence, DI, logs and response/error behavior need semantic/contract review.",
      "selectedLaneFiles": 1
    },
    {
      "detectorIds": [
        "be-library-contract"
      ],
      "familyId": "be-library-published-contract",
      "implementationStatus": "review-only",
      "lane": "be-library",
      "note": "Source boundary located; actual published graph and consumers require review.",
      "selectedLaneFiles": 0
    },
    {
      "detectorIds": [],
      "familyId": "be-library-structure-overlap",
      "implementationStatus": "not-implemented",
      "lane": "be-library",
      "note": "C# structure and similar signatures do not prove duplicate capability.",
      "selectedLaneFiles": 0
    },
    {
      "detectorIds": [],
      "familyId": "be-library-request-and-feature-contracts",
      "implementationStatus": "not-implemented",
      "lane": "be-library",
      "note": "Request priority, compatibility and README/Playground/tests need owned evidence.",
      "selectedLaneFiles": 0
    },
    {
      "detectorIds": [
        "sql-procedure-declaration"
      ],
      "familyId": "sql-procedure-output",
      "implementationStatus": "automated",
      "lane": "sql-procedure",
      "note": "Lexical declaration candidate; new/touched deployment role unresolved.",
      "selectedLaneFiles": 1
    },
    {
      "detectorIds": [
        "sql-table-contract"
      ],
      "familyId": "sql-table-ddl",
      "implementationStatus": "review-only",
      "lane": "sql-table",
      "note": "Location classified; object-per-file/DDL/section/schema constraints require owner-schema review.",
      "selectedLaneFiles": 0
    },
    {
      "detectorIds": [
        "sql-message-contract"
      ],
      "familyId": "sql-message-guards",
      "implementationStatus": "review-only",
      "lane": "sql-messages",
      "note": "File located; guards/codes/meaning not automatically validated.",
      "selectedLaneFiles": 0
    },
    {
      "detectorIds": [],
      "familyId": "sql-business-compatibility",
      "implementationStatus": "not-implemented",
      "lane": "sql-procedure",
      "note": "Suffix exceptions, results/errors/transactions and table/message reconciliation need owner evidence.",
      "selectedLaneFiles": 1
    },
    {
      "detectorIds": [],
      "familyId": "sql-table-data-semantics",
      "implementationStatus": "not-implemented",
      "lane": "sql-table",
      "note": "ID migration, indexes, cascade, seeds and relationships are never inferred from signatures.",
      "selectedLaneFiles": 0
    }
  ],
  "comparison": {
    "baseSnapshot": null,
    "baselineReportId": null,
    "comparisonStatus": "not-requested",
    "removedFindingIds": []
  },
  "coverage": {
    "discovered": 4,
    "excluded": 0,
    "selected": 4,
    "selectedByLane": {
      "be-main": 1,
      "fe-library": 1,
      "fe-main": 1,
      "sql-procedure": 1
    }
  },
  "files": [
    {
      "digest": "31d247d2ed0fca18e6e2fad840b72dbf194074564b9ea75159e9a1cd2d8e1704",
      "lane": "fe-main",
      "path": "apps/web/agmwa-fixture-ng/src/app/features/demo/demo.component.ts",
      "profile": null,
      "selected": true
    },
    {
      "digest": "fe75de3752c70ecfc5751f9f682a3a5723faf69a831e1ccf853b33c45c8a8449",
      "lane": "be-main",
      "path": "services/agmws-fixture-netcore/Src/Application/UseCases/Demo.cs",
      "profile": "agmws",
      "selected": true
    },
    {
      "digest": "c25a1369c379828c1171c2a0c73d1c8664691a5b5d17998c1e1e18291e8fd4a7",
      "lane": "sql-procedure",
      "path": "services/agmws-fixture-netcore/sql/DEMO/procedure/DEMO_Q.sql",
      "profile": null,
      "selected": true
    },
    {
      "digest": "6bacb065a3731208e963e5ecdf4ff9565622ac90117d936ea844c2c58e72f95d",
      "lane": "fe-library",
      "path": "standards/libraries/angular/agrimap-platform/projects/dynamic-lut/src/public-api.ts",
      "profile": null,
      "selected": true
    }
  ],
  "findings": [
    {
      "actualEvidenceLevel": "syntax",
      "applicability": "applicable",
      "authority": {
        "collection": "frontend-main",
        "collectionManifestDigest": "6ceef6c680384e22d7470ad895b7cde24507e31e0d291ba70d9b07df2720713c",
        "collectionSourceStatus": "current",
        "conflictResolutionDigest": "44fddaa56716dd37d8d7c6235551127fcf3d5745b44c89586b2676ed7069b381",
        "entry": "references/patterns/golden/frontend-main/008-3-typesafe-t6-forbidden.ts",
        "entryDigest": "87594b1d0ebed048fc75c62e4b64b59d99e1aa9e79df2f0136cc86484dc34628",
        "exceptionEvidence": [],
        "goldenRuleId": "T6",
        "ownerEvidence": [],
        "packageName": "agrimap-agent-skills",
        "revision": null,
        "rootManifestDigest": "7759584666c116ef34c47811759838ba1ea2c5c0a235facfa0a6f1c66a0f7537",
        "sourceStatus": "current",
        "sourceStatusBasis": "collection-manifest",
        "tier": "MUST",
        "version": "4.11.0"
      },
      "changeOrigin": "unknown",
      "codeScope": "unknown",
      "column": 21,
      "comparisonStatus": "not-requested",
      "confidence": {
        "level": "high",
        "rationale": "Parsed explicit syntax and pinned applicable source; impact remains unknown."
      },
      "detectorId": "fe-explicit-any",